question,difficulty,topics,link,frequency,acceptance
Rotate Image,MEDIUM,"Array, Math, Matrix",https://leetcode.com/problems/rotate-image,100.0,0.7790173789665304
Spiral Matrix,MEDIUM,"Array, Matrix, Simulation",https://leetcode.com/problems/spiral-matrix,100.0,0.539398836789508
Number of 1 Bits,EASY,"Divide and Conquer, Bit Manipulation",https://leetcode.com/problems/number-of-1-bits,100.0,0.7450480575885099
Two Sum,EASY,"Array, Hash Table",https://leetcode.com/problems/two-sum,100.0,0.5577702792380397
Longest Substring Without Repeating Characters,MEDIUM,"Hash Table, String, Sliding Window",https://leetcode.com/problems/longest-substring-without-repeating-characters,87.5,0.3693614497740018
Climbing Stairs,EASY,"Math, Dynamic Programming, Memoization",https://leetcode.com/problems/climbing-stairs,87.5,0.535407976724555
Kth Largest Element in an Array,MEDIUM,"Array, Divide and Conquer, Sorting, Heap (Priority Queue), Quickselect",https://leetcode.com/problems/kth-largest-element-in-an-array,87.5,0.6797703802112421
Subarray Sum Equals K,MEDIUM,"Array, Hash Table, Prefix Sum",https://leetcode.com/problems/subarray-sum-equals-k,87.5,0.4547633179081555
Roman to Integer,EASY,"Hash Table, Math, String",https://leetcode.com/problems/roman-to-integer,87.5,0.6486637744329325
Merge Intervals,MEDIUM,"Array, Sorting",https://leetcode.com/problems/merge-intervals,87.5,0.4939525764689584
3Sum,MEDIUM,"Array, Two Pointers, Sorting",https://leetcode.com/problems/3sum,87.5,0.3707108091763312
