question,difficulty,topics,link,frequency,acceptance
Zigzag Conversion,MEDIUM,String,https://leetcode.com/problems/zigzag-conversion,100.0,0.5160678115303926
LRU Cache,MEDIUM,"Hash Table, Linked List, Design, Doubly-Linked List",https://leetcode.com/problems/lru-cache,79.2,0.4521457621314454
Minimum Replacements to Sort the Array,HARD,"Array, Math, Greedy",https://leetcode.com/problems/minimum-replacements-to-sort-the-array,77.5,0.5324087646108167
Count Vowel Strings in Ranges,MEDIUM,"Array, String, Prefix Sum",https://leetcode.com/problems/count-vowel-strings-in-ranges,77.5,0.6786629908928055
Count the Number of Vowel Strings in Range,EASY,"Array, String, Counting",https://leetcode.com/problems/count-the-number-of-vowel-strings-in-range,77.5,0.7351821231161714
Meeting Scheduler,MEDIUM,"Array, Two Pointers, Sorting",https://leetcode.com/problems/meeting-scheduler,75.5,0.5522977372018112
Maximum Number of Integers to Choose From a Range I,MEDIUM,"Array, Hash Table, Binary Search, Greedy, Sorting",https://leetcode.com/problems/maximum-number-of-integers-to-choose-from-a-range-i,75.5,0.6791400643868877
Number of Valid Move Combinations On Chessboard,HARD,"Array, String, Backtracking, Simulation",https://leetcode.com/problems/number-of-valid-move-combinations-on-chessboard,75.5,0.4773802763581298
Word Search,MEDIUM,"Array, String, Backtracking, Depth-First Search, Matrix",https://leetcode.com/problems/word-search,75.5,0.4526692829987259
Time Needed to Rearrange a Binary String,MEDIUM,"String, Dynamic Programming, Simulation",https://leetcode.com/problems/time-needed-to-rearrange-a-binary-string,75.5,0.5155956910874109
Number of Islands,MEDIUM,"Array, Depth-First Search, Breadth-First Search, Union Find, Matrix",https://leetcode.com/problems/number-of-islands,75.5,0.6231993213058742
Maximum Frequency Score of a Subarray,HARD,"Array, Hash Table, Math, Stack, Sliding Window",https://leetcode.com/problems/maximum-frequency-score-of-a-subarray,75.5,0.3515392254220457
Minimum Non-Zero Product of the Array Elements,MEDIUM,"Math, Greedy, Recursion",https://leetcode.com/problems/minimum-non-zero-product-of-the-array-elements,73.4,0.3633183019748095
Maximum Number of Integers to Choose From a Range II,MEDIUM,"Array, Binary Search, Greedy, Sorting",https://leetcode.com/problems/maximum-number-of-integers-to-choose-from-a-range-ii,73.4,0.3501022494887525
Paint House III,HARD,"Array, Dynamic Programming",https://leetcode.com/problems/paint-house-iii,73.4,0.6098395490806937
Maximum Sum Obtained of Any Permutation,MEDIUM,"Array, Greedy, Sorting, Prefix Sum",https://leetcode.com/problems/maximum-sum-obtained-of-any-permutation,73.4,0.393747339545003
Count Array Pairs Divisible by K,HARD,"Array, Math, Number Theory",https://leetcode.com/problems/count-array-pairs-divisible-by-k,73.4,0.3014857343209011
Smallest Greater Multiple Made of Two Digits,MEDIUM,"Math, Enumeration",https://leetcode.com/problems/smallest-greater-multiple-made-of-two-digits,73.4,0.4793917567026811
Best Time to Buy and Sell Stock,EASY,"Array, Dynamic Programming",https://leetcode.com/problems/best-time-to-buy-and-sell-stock,73.4,0.5525965239541591
Group Anagrams,MEDIUM,"Array, Hash Table, String, Sorting",https://leetcode.com/problems/group-anagrams,73.4,0.7092882008000586
Longest Increasing Subsequence,MEDIUM,"Array, Binary Search, Dynamic Programming",https://leetcode.com/problems/longest-increasing-subsequence,71.0,0.5780836795005291
Maximal Square,MEDIUM,"Array, Dynamic Programming, Matrix",https://leetcode.com/problems/maximal-square,71.0,0.4876133314788993
Two Sum,EASY,"Array, Hash Table",https://leetcode.com/problems/two-sum,71.0,0.5577699372797245
Product of Array Except Self,MEDIUM,"Array, Prefix Sum",https://leetcode.com/problems/product-of-array-except-self,68.4,0.6777995730835785
Coin Change,MEDIUM,"Array, Dynamic Programming, Breadth-First Search",https://leetcode.com/problems/coin-change,68.4,0.4649545396006711
Pairs of Songs With Total Durations Divisible by 60,MEDIUM,"Array, Hash Table, Counting",https://leetcode.com/problems/pairs-of-songs-with-total-durations-divisible-by-60,65.5,0.5324772640938334
Longest Substring Without Repeating Characters,MEDIUM,"Hash Table, String, Sliding Window",https://leetcode.com/problems/longest-substring-without-repeating-characters,62.0,0.3693617213196236
Minimum Absolute Difference,EASY,"Array, Sorting",https://leetcode.com/problems/minimum-absolute-difference,62.0,0.7065237783248814
Merge Intervals,MEDIUM,"Array, Sorting",https://leetcode.com/problems/merge-intervals,62.0,0.4939526057316443
Merge Sorted Array,EASY,"Array, Two Pointers, Sorting",https://leetcode.com/problems/merge-sorted-array,62.0,0.5291952521829845
Subarray Sum Equals K,MEDIUM,"Array, Hash Table, Prefix Sum",https://leetcode.com/problems/subarray-sum-equals-k,62.0,0.4547620606469613
Find the Smallest Divisor Given a Threshold,MEDIUM,"Array, Binary Search",https://leetcode.com/problems/find-the-smallest-divisor-given-a-threshold,58.0,0.6364613847469199
Maximum Number of Events That Can Be Attended,MEDIUM,"Array, Greedy, Sorting, Heap (Priority Queue)",https://leetcode.com/problems/maximum-number-of-events-that-can-be-attended,58.0,0.3292198182552009
Loud and Rich,MEDIUM,"Array, Depth-First Search, Graph, Topological Sort",https://leetcode.com/problems/loud-and-rich,58.0,0.616717862975348
Reorganize String,MEDIUM,"Hash Table, String, Greedy, Sorting, Heap (Priority Queue), Counting",https://leetcode.com/problems/reorganize-string,58.0,0.5619634145417838
Valid Anagram,EASY,"Hash Table, String, Sorting",https://leetcode.com/problems/valid-anagram,53.0,0.6666090585307833
Count Vowel Substrings of a String,EASY,"Hash Table, String",https://leetcode.com/problems/count-vowel-substrings-of-a-string,53.0,0.7148136172571481
Valid Parentheses,EASY,"String, Stack",https://leetcode.com/problems/valid-parentheses,53.0,0.4232283388603495
Trapping Rain Water,HARD,"Array, Two Pointers, Dynamic Programming, Stack, Monotonic Stack",https://leetcode.com/problems/trapping-rain-water,53.0,0.6510194684590559
House Robber,MEDIUM,"Array, Dynamic Programming",https://leetcode.com/problems/house-robber,53.0,0.5230497402554785
Meeting Rooms III,HARD,"Array, Hash Table, Sorting, Heap (Priority Queue), Simulation",https://leetcode.com/problems/meeting-rooms-iii,53.0,0.4393472442856221
Random Pick with Weight,MEDIUM,"Array, Math, Binary Search, Prefix Sum, Randomized",https://leetcode.com/problems/random-pick-with-weight,53.0,0.4827836751158982
Sort Colors,MEDIUM,"Array, Two Pointers, Sorting",https://leetcode.com/problems/sort-colors,53.0,0.675831142046278
Last Stone Weight,EASY,"Array, Heap (Priority Queue)",https://leetcode.com/problems/last-stone-weight,53.0,0.6592869343167317
Top K Frequent Elements,MEDIUM,"Array, Hash Table, Divide and Conquer, Sorting, Heap (Priority Queue), Bucket Sort, Counting, Quickselect",https://leetcode.com/problems/top-k-frequent-elements,53.0,0.6456595513884866
Minimum Increment to Make Array Unique,MEDIUM,"Array, Greedy, Sorting, Counting",https://leetcode.com/problems/minimum-increment-to-make-array-unique,46.7,0.603327781549441
Maximum Subarray,MEDIUM,"Array, Divide and Conquer, Dynamic Programming",https://leetcode.com/problems/maximum-subarray,46.7,0.5209977597071156
Median of Two Sorted Arrays,HARD,"Array, Binary Search, Divide and Conquer",https://leetcode.com/problems/median-of-two-sorted-arrays,46.7,0.4381459789553303
Kth Largest Element in an Array,MEDIUM,"Array, Divide and Conquer, Sorting, Heap (Priority Queue), Quickselect",https://leetcode.com/problems/kth-largest-element-in-an-array,46.7,0.6797698507530842
Rotate Image,MEDIUM,"Array, Math, Matrix",https://leetcode.com/problems/rotate-image,46.7,0.7790165261990751
Koko Eating Bananas,MEDIUM,"Array, Binary Search",https://leetcode.com/problems/koko-eating-bananas,46.7,0.4906730142738797
Palindromic Substrings,MEDIUM,"Two Pointers, String, Dynamic Programming",https://leetcode.com/problems/palindromic-substrings,46.7,0.7167859571435372
Jump Game,MEDIUM,"Array, Dynamic Programming, Greedy",https://leetcode.com/problems/jump-game,46.7,0.3947921593161437
Text Justification,HARD,"Array, String, Simulation",https://leetcode.com/problems/text-justification,46.7,0.4814993566410409
Minimum Number of Swaps to Make the String Balanced,MEDIUM,"Two Pointers, String, Stack, Greedy",https://leetcode.com/problems/minimum-number-of-swaps-to-make-the-string-balanced,46.7,0.7796926022806927
3Sum Smaller,MEDIUM,"Array, Two Pointers, Binary Search, Sorting",https://leetcode.com/problems/3sum-smaller,46.7,0.5098856904205789
Count and Say,MEDIUM,String,https://leetcode.com/problems/count-and-say,46.7,0.6050656775612677
Subarray Product Less Than K,MEDIUM,"Array, Binary Search, Sliding Window, Prefix Sum",https://leetcode.com/problems/subarray-product-less-than-k,46.7,0.5285345535980827
Reverse Linked List,EASY,"Linked List, Recursion",https://leetcode.com/problems/reverse-linked-list,46.7,0.7920655049010822
Happy Number,EASY,"Hash Table, Math, Two Pointers",https://leetcode.com/problems/happy-number,46.7,0.5807264413215366
Find First and Last Position of Element in Sorted Array,MEDIUM,"Array, Binary Search",https://leetcode.com/problems/find-first-and-last-position-of-element-in-sorted-array,46.7,0.468287686874522
Search in Rotated Sorted Array,MEDIUM,"Array, Binary Search",https://leetcode.com/problems/search-in-rotated-sorted-array,46.7,0.4283721632586699
Degree of an Array,EASY,"Array, Hash Table",https://leetcode.com/problems/degree-of-an-array,46.7,0.5742057825337067
Valid Sudoku,MEDIUM,"Array, Hash Table, Matrix",https://leetcode.com/problems/valid-sudoku,46.7,0.6227676961475801
Flatten Deeply Nested Array,MEDIUM,,https://leetcode.com/problems/flatten-deeply-nested-array,46.7,0.6443499752842314
LFU Cache,HARD,"Hash Table, Linked List, Design, Doubly-Linked List",https://leetcode.com/problems/lfu-cache,46.7,0.4660898637811462
3Sum,MEDIUM,"Array, Two Pointers, Sorting",https://leetcode.com/problems/3sum,46.7,0.3707096047813656
Longest Consecutive Sequence,MEDIUM,"Array, Hash Table, Union Find",https://leetcode.com/problems/longest-consecutive-sequence,46.7,0.4704083978489664
Meeting Rooms II,MEDIUM,"Array, Two Pointers, Greedy, Sorting, Heap (Priority Queue), Prefix Sum",https://leetcode.com/problems/meeting-rooms-ii,37.9,0.5214162081616772
Squares of a Sorted Array,EASY,"Array, Two Pointers, Sorting",https://leetcode.com/problems/squares-of-a-sorted-array,37.9,0.7321924114088272
Course Schedule,MEDIUM,"Depth-First Search, Breadth-First Search, Graph, Topological Sort",https://leetcode.com/problems/course-schedule,37.9,0.4923432405366955
Search a 2D Matrix II,MEDIUM,"Array, Binary Search, Divide and Conquer, Matrix",https://leetcode.com/problems/search-a-2d-matrix-ii,37.9,0.5522251243876155
Maximum Profit in Job Scheduling,HARD,"Array, Binary Search, Dynamic Programming, Sorting",https://leetcode.com/problems/maximum-profit-in-job-scheduling,37.9,0.5441735043380527
Spiral Matrix,MEDIUM,"Array, Matrix, Simulation",https://leetcode.com/problems/spiral-matrix,37.9,0.5393976057408939
Flatten Binary Tree to Linked List,MEDIUM,"Linked List, Stack, Tree, Depth-First Search, Binary Tree",https://leetcode.com/problems/flatten-binary-tree-to-linked-list,37.9,0.6851012546095053
Find Median from Data Stream,HARD,"Two Pointers, Design, Sorting, Heap (Priority Queue), Data Stream",https://leetcode.com/problems/find-median-from-data-stream,37.9,0.5327813617707072
Find Pivot Index,EASY,"Array, Prefix Sum",https://leetcode.com/problems/find-pivot-index,37.9,0.6057029910807422
Path Sum,EASY,"Tree, Depth-First Search, Breadth-First Search, Binary Tree",https://leetcode.com/problems/path-sum,37.9,0.5300469853162927
Maximum Product Subarray,MEDIUM,"Array, Dynamic Programming",https://leetcode.com/problems/maximum-product-subarray,37.9,0.3494162852551506
Lexicographically Smallest Palindrome,EASY,"Two Pointers, String, Greedy",https://leetcode.com/problems/lexicographically-smallest-palindrome,37.9,0.7942312085903587
Maximum Population Year,EASY,"Array, Counting, Prefix Sum",https://leetcode.com/problems/maximum-population-year,37.9,0.6267903102222048
Min Stack,MEDIUM,"Stack, Design",https://leetcode.com/problems/min-stack,37.9,0.5644511757883331
Word Search II,HARD,"Array, String, Backtracking, Trie, Matrix",https://leetcode.com/problems/word-search-ii,37.9,0.3732633211647155
Delete Node in a Linked List,MEDIUM,Linked List,https://leetcode.com/problems/delete-node-in-a-linked-list,37.9,0.8231559199073729
Minimum Window Substring,HARD,"Hash Table, String, Sliding Window",https://leetcode.com/problems/minimum-window-substring,37.9,0.4535070101132958
First Unique Character in a String,EASY,"Hash Table, String, Queue, Counting",https://leetcode.com/problems/first-unique-character-in-a-string,37.9,0.6369549089916232
Maximum Frequency Stack,HARD,"Hash Table, Stack, Design, Ordered Set",https://leetcode.com/problems/maximum-frequency-stack,37.9,0.6620493032659615
Invalid Transactions,MEDIUM,"Array, Hash Table, String, Sorting",https://leetcode.com/problems/invalid-transactions,37.9,0.3127080304862309
Container With Most Water,MEDIUM,"Array, Two Pointers, Greedy",https://leetcode.com/problems/container-with-most-water,37.9,0.5778283755661647
Process Tasks Using Servers,MEDIUM,"Array, Heap (Priority Queue)",https://leetcode.com/problems/process-tasks-using-servers,37.9,0.4114853370058328
Find Peak Element,MEDIUM,"Array, Binary Search",https://leetcode.com/problems/find-peak-element,37.9,0.4650922923947054
Intersection of Two Arrays,EASY,"Array, Hash Table, Two Pointers, Binary Search, Sorting",https://leetcode.com/problems/intersection-of-two-arrays,37.9,0.7647431845238689
Find Minimum in Rotated Sorted Array,MEDIUM,"Array, Binary Search",https://leetcode.com/problems/find-minimum-in-rotated-sorted-array,37.9,0.5264826307240257
Minimum Number of Removals to Make Mountain Array,HARD,"Array, Binary Search, Dynamic Programming, Greedy",https://leetcode.com/problems/minimum-number-of-removals-to-make-mountain-array,37.9,0.5493114414333047
Divide Players Into Teams of Equal Skill,MEDIUM,"Array, Hash Table, Two Pointers, Sorting",https://leetcode.com/problems/divide-players-into-teams-of-equal-skill,37.9,0.6892726777444839
Jump Game II,MEDIUM,"Array, Dynamic Programming, Greedy",https://leetcode.com/problems/jump-game-ii,37.9,0.415032966531176
Number of Substrings Containing All Three Characters,MEDIUM,"Hash Table, String, Sliding Window",https://leetcode.com/problems/number-of-substrings-containing-all-three-characters,37.9,0.7317127949967176
First Missing Positive,HARD,"Array, Hash Table",https://leetcode.com/problems/first-missing-positive,37.9,0.4108465766394882
Merge In Between Linked Lists,MEDIUM,Linked List,https://leetcode.com/problems/merge-in-between-linked-lists,37.9,0.8230365933376913
Design Twitter,MEDIUM,"Hash Table, Linked List, Design, Heap (Priority Queue)",https://leetcode.com/problems/design-twitter,37.9,0.4265219380138987
