question,difficulty,topics,link,frequency,acceptance
Longest Happy String,MEDIUM,"String, Greedy, Heap (Priority Queue)",https://leetcode.com/problems/longest-happy-string,100.0,0.6546225631378025
Best Time to Buy and Sell Stock II,MEDIUM,"Array, Dynamic Programming, Greedy",https://leetcode.com/problems/best-time-to-buy-and-sell-stock-ii,100.0,0.6950040865642816
Best Time to Buy and Sell Stock,EASY,"Array, Dynamic Programming",https://leetcode.com/problems/best-time-to-buy-and-sell-stock,100.0,0.5525969245782094
LRU Cache,MEDIUM,"Hash Table, Linked List, Design, Doubly-Linked List",https://leetcode.com/problems/lru-cache,100.0,0.4521488470379119
Rotate Image,MEDIUM,"Array, Math, Matrix",https://leetcode.com/problems/rotate-image,100.0,0.7790171169832033
3Sum,MEDIUM,"Array, Two Pointers, Sorting",https://leetcode.com/problems/3sum,100.0,0.3707111823526769
